{
    "$schema": "../../schemas/plugin.json",

    "name": "AGLight v1.0.0",
    "previousVersions": {},
    "description": [
        "<p><em>AGLight</em> is a lighting software with a completely configurable UI.",
        "You can add different widgets and build your own user interface with drag and drop.</p>"
    ],
    "links": {
        "Website": "https://github.com/hrueger/AGLight/"
    },
    "fixtureUsage": [
        "<p>You don't need to download the fixtures, just click on the library button in the bottom statusbar and click update.</p>"
    ]
}